{
  "schema_version": "dv.content/0.4.0-draft.1",
  "record_id": "FIXTURE-NON-PUBLIABLE-001",
  "record_revision": 1,
  "content_kind": "speech_vote",
  "policy_version": "DV-PUB-1",
  "method_version": "M0.1-test",
  "data_scope": "synthetic",
  "source_versions": [
    {
      "source_id": "S-TEXT",
      "version": "fixture-v1",
      "public_url": "https://example.org/fixtures/text-not-fetched"
    },
    {
      "source_id": "S-VOTE",
      "version": "fixture-v1",
      "public_url": "https://example.org/fixtures/vote-not-fetched"
    },
    {
      "source_id": "S-SPEECH",
      "version": "fixture-v1",
      "public_url": "https://example.org/fixtures/speech-not-fetched"
    }
  ],
  "public": {
    "title": "DOSSIER FICTIF DE TEST",
    "short_answer": "Réponse fictive",
    "main_caveat": "Test, pas une conclusion politique.",
    "reasoning": "Justification fictive",
    "result": "convergence",
    "declaration_quote": "Citation inventée pour un test logiciel.",
    "declaration_source_url": "https://example.org/fixtures/speech-not-fetched",
    "official_text_url": "https://example.org/fixtures/text-not-fetched",
    "official_vote_url": "https://example.org/fixtures/vote-not-fetched"
  }
}
